{
  "resume_id": "zhong_zimin_2026_001",
  "personal_info": {
    "name": "钟梓珉",
    "contact": {
      "phone": "133****2777",
      "email": "hosheil@outlook.com"
    },
    "position": "大模型应用/Agent开发工程师",
    "working_years": 0
  },
  "education": [
    {
      "school": "四川轻化工大学",
      "major": "计算机科学与技术",
      "degree": "本科",
      "duration": {
        "start": "2024-09",
        "end": "至今"
      },
      "highlights": [
        "专业排名前1%",
        "获得一等奖学金",
        "担任人工智能协会学科竞赛部副部长",
        "获得2025年全球校园人工智能算法精英大赛国家级一等奖",
        "主修课程: 数据结构与算法设计、操作系统、人工智能、计算机组成原理"
      ]
    }
  ],
  "work_experience": [
    {
      "company": "省重点人工智能实验室",
      "position": "学生科研组成员",
      "duration": {
        "start": "2024-11",
        "end": "至今"
      },
      "company_industry": "教育/科研",
      "company_scale": "大型",
      "achievements": [
        "参与自动驾驶与智能导航方向科研训练，支持视觉语言导航(VLN)与强化学习导航任务 [cite: 18]",
        "协助完成自动驾驶系统功能模块开发，提升对多模态感知与导航决策的理解 [cite: 20, 25]",
        "负责实验数据处理与性能分析，支持项目迭代优化并复现相关科研成果 [cite: 22, 25]"
      ],
      "technologies_used": [
        "Python",
        "强化学习",
        "多模态应用"
      ]
    }
  ],
  "project_experience": [
    {
      "name": "多模态课程知识库与 Learning Agent 系统",
      "role": "核心开发者",
      "duration": {
        "start": "2025-11",
        "end": "2026-02"
      },
      "description": "面向课程学习场景，融合多模态数据与知识图谱的 RAG 辅助学习系统 [cite: 41]",
      "responsibilities": [
        "负责知识点抽取与知识图谱构建，使用 Neo4j 实现课程知识结构化存储 [cite: 43, 44]",
        "基于 LangChain/LangGraph 搭建多 Agent 工作流，实现检索路由与答案生成 [cite: 45]",
        "结合向量数据库实现混合召回，优化非结构化内容的查询能力 [cite: 44]"
      ],
      "technologies": [
        "LangChain",
        "LangGraph",
        "Neo4j",
        "Milvus",
        "RAG"
      ],
      "results": "实现基于 RAG + Multi-Agent 的原型系统，支持高精度的课程问答与知识关联查询 [cite: 49]"
    },
    {
      "name": "鉴定推荐项目 [Vapp]",
      "role": "核心开发者",
      "duration": {
        "start": "2025-06",
        "end": "2025-09"
      },
      "description": "基于多模态模型的电商商品识别与 Agent 自动化推荐系统 [cite: 30]",
      "responsibilities": [
        "设计并开发“图片上传-模型识别-Agent编排-推荐输出”的完整业务链路 [cite: 32]",
        "基于调优后的多模态模型提升系统对商品图片的理解与识别精度 [cite: 33]",
        "使用 Agent 机制组织检索与推荐任务，完成工具调用与后端接口联调 [cite: 34]"
      ],
      "technologies": [
        "Python",
        "Agent",
        "多模态模型",
        "FastAPI"
      ],
      "results": "完成核心功能闭环，成功构建支持自动识别与推荐的可运行系统原型 [cite: 36]"
    }
  ],
  "skills": {
    "programming_languages": [
      "Python",
      "Java",
      "SQL"
    ],
    "frameworks": [
      "FastAPI",
      "Flask",
      "Spring Boot"
    ],
    "databases": [
      "MySQL",
      "Neo4j",
      "Milvus"
    ],
    "tools": [
      "Git",
      "Docker"
    ],
    "ai_ml": [
      "LangChain",
      "LangGraph",
      "RAG",
      "Agent",
      "知识图谱",
      "多模态应用",
      "强化学习"
    ],
    "soft_skills": [
      "科研讨论",
      "实验分析",
      "团队协作"
    ]
  },
  "self_evaluation": "熟悉 Python/Java 后端开发与 AI 应用，具备 LangChain/LangGraph 多 Agent 协作实践经验。在大模型 RAG 问答、知识图谱构建及自动驾驶科研训练方面有扎实基础。专业排名 1% 并获国家级算法竞赛一等奖，具备极强的学习能力与技术落地意识。 [cite: 7, 9, 55, 57]"
}