{
  "resume_id": "zhang_audit_2027_003",
  "personal_info": {
    "name": "张",
    "contact": {
      "phone": "1**********",
      "email": "未提供"
    },
    "position": "工程审计/工程造价/审计专员",
    "working_years": 2
  },
  "education": [
    {
      "school": "西南财经大学天府学院",
      "major": "工程审计",
      "degree": "本科",
      "duration": {
        "start": "2025-00",
        "end": "2027-00"
      },
      "highlights": [
        "全日制本科（27年应届）",
        "核心课程：会计学原理、财务管理、工程项目管理、审计实务、竣工结算等 [cite: 359]"
      ]
    },
    {
      "school": "西华大学",
      "major": "汉语言文学",
      "degree": "本科",
      "duration": {
        "start": "2020-00",
        "end": "2025-00"
      },
      "highlights": [
        "自考本科",
        "核心能力：公文写作、报告撰写、材料整理 [cite: 355]"
      ]
    },
    {
      "school": "巴中职业技术学院",
      "major": "工程造价",
      "degree": "专科",
      "duration": {
        "start": "2020-00",
        "end": "2025-00"
      },
      "highlights": [
        "全日制专科",
        "核心课程：建筑工程计量计价、广联达造价软件、CAD、招投标管理 [cite: 351]"
      ]
    }
  ],
  "work_experience": [
    {
      "company": "中国人民武装警察部队",
      "position": "普通士兵",
      "duration": {
        "start": "2022-03",
        "end": "2024-03"
      },
      "company_industry": "国防/军事",
      "company_scale": "大型",
      "achievements": [
        "负责物资管理、台账登记及数据核对，养成严谨细致、规范留痕的工作习惯 [cite: 367]",
        "执行任务指令，具备极强执行力、抗压能力与应急处置能力 [cite: 366]",
        "参与野外驻训与应急保障任务，完全适应驻外、驻场及不规律作息 [cite: 368]"
      ],
      "technologies_used": [
        "物资管理",
        "文书整理",
        "安全管控"
      ]
    },
    {
      "company": "中铁隧道局",
      "position": "普通工人",
      "duration": {
        "start": "2024-07",
        "end": "2025-01"
      },
      "company_industry": "建筑/工程",
      "company_scale": "上市公司",
      "achievements": [
        "深入施工一线，了解工程现场实际操作与流程，强化工程审计所需的现场核查素养 [cite: 369, 373]"
      ],
      "technologies_used": [
        "现场核查",
        "起重机装卸",
        "安全员实务"
      ]
    }
  ],
  "project_experience": [],
  "skills": {
    "programming_languages": [],
    "frameworks": [
      "广联达"
    ],
    "databases": [],
    "tools": [
      "CAD",
      "Office",
      "WPS"
    ],
    "ai_ml": [],
    "soft_skills": [
      "公文写作",
      "抗压能力",
      "吃苦耐劳",
      "闭环落实"
    ]
  },
  "certificates": [
    {
      "name": "安全员C2证书",
      "issuer": "建设部门"
    },
    {
      "name": "预算员证书",
      "issuer": "相关机构"
    },
    {
      "name": "初级（五级）起重机装卸工"
    },
    {
      "name": "C1D机动车驾驶证"
    }
  ],
  "languages": [
    {
      "language": "英语",
      "level": "CET-4"
    },
    {
      "language": "普通话",
      "level": "二级乙等"
    }
  ],
  "self_evaluation": "拥有工程审计（本科）与工程造价（专科）双重专业背景，基础扎实，完全匹配岗位要求 [cite: 379]。两年的武警服役经历塑造了极强的纪律性与执行力，可长期接受驻场及出差 [cite: 368, 379]。具备优秀的文字表达与报告撰写能力，作风踏实、服从管理 [cite: 379]。"
}