{
  "resume_id": "chen_xiaoyu_2026_002",
  "personal_info": {
    "name": "陈小鱼",
    "contact": {
      "phone": "135****5000",
      "email": "service@500d.m"
    },
    "position": "应届生通用",
    "working_years": 0
  },
  "education": [
    {
      "school": "河北财经大学",
      "major": "财务管理",
      "degree": "本科",
      "duration": {
        "start": "2005-07",
        "end": "2009-06"
      },
      "gpa": "3.8/4.0",
      "highlights": [
        "专业排名前10%",
        "获2014-2015学年校一等奖学金",
        "获2015-2016学年国家奖学金",
        "主修课程：管理学、微观经济学、宏观经济学、统计学、会计学、财务管理、公司理财、经济法等"
      ]
    }
  ],
  "work_experience": [],
  "project_experience": [
    {
      "name": "院学生会活动策划与执行",
      "role": "干事",
      "duration": {
        "start": "2013-09",
        "end": "2014-06"
      },
      "description": "参与学院学生会日常运作及大型活动组织策划工作 [cite: 277, 315]",
      "responsibilities": [
        "积极参与学生会各项活动策划，与其他干事协作完成方案制定 [cite: 278, 316]",
        "负责学院活动赞助拉取，制作赞助方案并上门拜访企业进行商务洽谈 [cite: 279, 317]",
        "参与举办多场大型活动，如“迎新晚会”、“送毕业生晚会”等 [cite: 280, 318]"
      ],
      "technologies": [
        "活动策划",
        "商务洽谈",
        "团队协作"
      ],
      "results": "成功举办多次大型学院活动，并有效保障了活动经费的赞助落实 [cite: 280, 318]"
    }
  ],
  "skills": {
    "programming_languages": [],
    "frameworks": [],
    "databases": [
      "Access"
    ],
    "tools": [
      "MS Office",
      "Excel",
      "Word",
      "PPT"
    ],
    "ai_ml": [],
    "soft_skills": [
      "沟通技巧",
      "团队精神",
      "组织判断能力",
      "公关能力"
    ]
  },
  "certificates": [
    {
      "name": "会计从业资格证书",
      "issuer": "财政部门"
    },
    {
      "name": "助理会计师资格证(初级会计师)",
      "issuer": "人力资源和社会保障部"
    },
    {
      "name": "计算机二级 MS Office 高级应用",
      "issuer": "教育部考试中心"
    }
  ],
  "languages": [
    {
      "language": "英语",
      "level": "CET-6"
    },
    {
      "language": "普通话",
      "level": "二级甲等"
    }
  ],
  "self_evaluation": "掌握财务专业知识技能，具有良好的道德修养和职业素养。为人诚实可靠，品行端正，具备极强的亲和力与独立工作能力，能承受高强度工作压力，注重效率与团队协作 [cite: 289, 290, 292]。"
}